{
  "id": "example-ecommerce-internship",
  "kind": "internship",
  "organization": "Example Commerce Company",
  "title": "Ecommerce Operations Intern",
  "start": "2025.06",
  "end": "2025.09",
  "description": "Supported a seasonal campaign by maintaining product data, monitoring conversion metrics, coordinating creative assets, and summarizing weekly findings for the team. Replace this fictional example with verified private facts.",
  "metrics": [],
  "do_not_claim": []
}
